{
  "$schema": "./tokens.schema.json",
  "typeface": [
    {
      "token": "--dsw-font-family",
      "claude": "'Anthropic Sans Web Text','DeepCraft Inter','Noto Sans SC','Source Han Sans SC',-apple-system,BlinkMacSystemFont,'Segoe UI','PingFang SC','Hiragino Sans GB','Microsoft YaHei','Helvetica Neue',Helvetica,Arial,sans-serif"
    },
    {
      "token": "--dsh-deepcraft-font-serif",
      "claude": "'Anthropic Serif Web Text','DeepCraft Noto Serif',Georgia,'Times New Roman','Noto Sans SC','Source Han Sans SC','PingFang SC','Hiragino Sans GB','Microsoft YaHei',sans-serif",
      "host": "var(--dsw-font-family)"
    },
    {
      "token": "--dsh-deepcraft-font-prose",
      "claude": "'Anthropic Serif Web Text','DeepCraft Noto Serif',Georgia,'Times New Roman','Noto Sans SC','Source Han Sans SC','PingFang SC','Hiragino Sans GB','Microsoft YaHei',sans-serif",
      "host": "var(--dsw-font-family)",
      "note": "Conversation prose: Claude sets Latin text in the serif face and lets Chinese fall through to a sans CJK — the serif Latin faces carry no CJK glyphs, so the stack leads with serif and names the sans CJK families after it. The interface keeps the sans stack; only Markdown prose uses this."
    },
    {
      "token": "--dsh-deepcraft-font-code",
      "claude": "'Anthropic Mono Web','JetBrains Mono','Noto Sans SC','Source Han Sans SC','PingFang SC','Hiragino Sans GB','Microsoft YaHei',ui-monospace,'SF Mono','Fira Code',Consolas,'Liberation Mono',Menlo,Courier,monospace",
      "host": "var(--ds-font-family-code)"
    },
    {
      "token": "--dsh-deepcraft-font-brand",
      "claude": "'Anthropic Serif Web Text', var(--dsh-deepcraft-font-serif)",
      "host": "var(--dsw-font-family)",
      "note": "Claude's lockup is drawn in Anthropic's serif, so its rows take the same face; the serif token stays behind it so a missing font degrades to the shipped serif."
    },
    {
      "token": "--dsw-font-markdown-h2",
      "claude": "700 calc(18px + var(--dsh-content-font-delta)) / calc(26px + var(--dsh-content-font-delta)) var(--dsh-deepcraft-font-prose)",
      "note": "The host reads these through a `font:` shorthand that names --dsw-font-family directly, so overriding the `-font-family` sub-tokens never reached the page: the shorthand itself has to be re-declared."
    },
    {
      "token": "--dsw-font-markdown-h3",
      "claude": "700 calc(16px + var(--dsh-content-font-delta)) / calc(24px + var(--dsh-content-font-delta)) var(--dsh-deepcraft-font-prose)"
    }
  ],
  "apex": [
    {
      "token": "--dsh-deepcraft-apex",
      "dark": "#9d8ce0",
      "light": "#8b7ad0"
    },
    {
      "token": "--dsh-deepcraft-apex-flash",
      "dark": "#e6e0fb",
      "light": "#d9d2f5"
    },
    {
      "token": "--dsh-deepcraft-apex-ink",
      "dark": "#b9adf0",
      "light": "#5f51b5"
    }
  ],
  "palette": [
    {
      "token": "--dsw-alias-bg-base",
      "claude": { "dark": "#141413", "light": "#fcfcfb" },
      "deepseek": { "dark": "#202427", "light": "#fcfcfb" }
    },
    {
      "token": "--dsw-alias-bg-layer-1",
      "claude": { "dark": "#1c1b1a", "light": "#fcfcfb" },
      "deepseek": { "dark": "#24282d", "light": "#fcfcfb" }
    },
    {
      "token": "--dsw-alias-bg-layer-2",
      "claude": { "dark": "#242320", "light": "#fbfbf9" },
      "deepseek": { "dark": "#2b3038", "light": "#f2f2ef" }
    },
    {
      "token": "--dsw-alias-bg-layer-3",
      "claude": { "dark": "#2e2c29", "light": "#f9f9f6" },
      "deepseek": { "dark": "#343b45", "light": "#ededea" }
    },
    {
      "token": "--dsw-alias-bg-overlay",
      "claude": { "dark": "#242320", "light": "#ffffff" },
      "deepseek": { "dark": "#2b3038", "light": "#fcfcfb" }
    },
    {
      "token": "--dsw-alias-border-l1",
      "use": "the standard edge: card and panel outlines, dividers, field outlines",
      "claude": { "dark": "rgba(255, 255, 255, 0.09)", "light": "#e8e6dc" },
      "deepseek": { "dark": "#3b424c", "light": "#e5e5e1" },
      "note": "The dark edge is a highlight, not a contour: a translucent white ring reads as the top light catching a chamfer and composites over whatever fill it lands on, where an opaque colour has to be re-picked per surface. The three dark rungs are that one highlight at .09, .18 and .30; the light rungs stay the warm opaque ladder, since on a light canvas an edge is a shadow."
    },
    {
      "token": "--dsw-alias-border-l2",
      "claude": { "dark": "rgba(255, 255, 255, 0.18)", "light": "#dedcd2" },
      "deepseek": { "dark": "#505863", "light": "#d4d5d2" }
    },
    {
      "token": "--dsw-alias-border-l3",
      "claude": { "dark": "rgba(255, 255, 255, 0.30)", "light": "#d0cdc1" },
      "deepseek": { "dark": "#6b7482", "light": "#b9bdc5" }
    },
    {
      "token": "--dsw-alias-brand-primary",
      "use": "the single accent: checks, focus rings, selected marks",
      "claude": { "dark": "#d97757", "light": "#d97757" },
      "deepseek": { "dark": "#5368c9", "light": "#5368c9" }
    },
    {
      "token": "--dsw-alias-brand-text",
      "claude": { "dark": "#faf9f5", "light": "#faf9f5" },
      "deepseek": { "dark": "#fcfcfb", "light": "#fcfcfb" }
    },
    {
      "token": "--dsw-alias-button-primary-fill",
      "claude": { "dark": "#d97757", "light": "#d97757" },
      "deepseek": { "dark": "#5368c9", "light": "#5368c9" },
      "note": "The host takes a primary button's fill from --dsw-alias-brand-primary but its hover from a monochrome step of its own scale, so both steps are stated here and the hover stays in the fill's family."
    },
    {
      "token": "--dsw-alias-button-primary-hover",
      "claude": { "dark": "#e08a6d", "light": "#c6613f" },
      "deepseek": { "dark": "#596dce", "light": "#3e5bd6" }
    },
    {
      "token": "--dsw-alias-button-elevated-fill",
      "claude": { "dark": "#242320", "light": "#ffffff" },
      "deepseek": { "dark": "#2b3038", "light": "#fcfcfb" },
      "note": "Palette-specific, like the solid hover chip: in light the host paints this surface lighter than the canvas, and the light ink it carries needs a light fill."
    },
    {
      "token": "--dsw-alias-button-floating-fill",
      "claude": { "dark": "#242320", "light": "#ffffff" },
      "deepseek": { "dark": "#2b3038", "light": "#fcfcfb" }
    },
    {
      "token": "--dsw-alias-button-floating-hover",
      "claude": { "dark": "#2e2c29", "light": "#ffffff" },
      "deepseek": { "dark": "#343b45", "light": "#ededea" }
    },
    {
      "token": "--dsw-alias-button-info-fill",
      "claude": { "dark": "#d97757", "light": "#d97757" },
      "deepseek": { "dark": "#5368c9", "light": "#5368c9" }
    },
    {
      "token": "--dsw-alias-button-info-hover",
      "claude": { "dark": "#e08a6d", "light": "#c6613f" },
      "deepseek": { "dark": "#596dce", "light": "#3e5bd6" }
    },
    {
      "token": "--dsw-alias-interactive-bg-active",
      "claude": { "dark": "rgba(217, 119, 87, 0.30)", "light": "rgba(217, 119, 87, 0.30)" },
      "deepseek": { "dark": "rgba(142, 162, 242, 0.32)", "light": "rgba(83, 104, 201, 0.26)" }
    },
    {
      "token": "--dsh-deepcraft-hover-bg",
      "use": "hover wash",
      "claude": { "dark": "rgba(255, 255, 255, 0.08)", "light": "rgba(0, 0, 0, 0.08)" },
      "deepseek": { "dark": "rgba(142, 162, 242, 0.16)", "light": "rgba(83, 104, 201, 0.14)" },
      "note": "DeepSeek's wash carries the brand blue rather than the neutral ink, so a selected conversation row reads as the theme's own.",
      "host": "var(--dsw-alias-interactive-bg-hover)"
    },
    {
      "token": "--dsh-deepcraft-inline-code-bg",
      "use": "inline code fill",
      "claude": { "dark": "rgba(255, 255, 255, 0.05)", "light": "rgba(0, 0, 0, 0.05)" },
      "deepseek": { "dark": "rgba(238, 240, 243, 0.06)", "light": "rgba(32, 33, 36, 0.045)" },
      "host": "var(--dsw-alias-markdown-inline-code)"
    },
    {
      "token": "--dsh-deepcraft-inline-code-fg",
      "use": "inline code ink",
      "claude": { "dark": "#e8a08a", "light": "#943333" },
      "deepseek": { "dark": "var(--dsw-alias-label-primary)", "light": "var(--dsw-alias-label-primary)" },
      "host": "var(--dsw-alias-label-primary)"
    },
    {
      "token": "--dsh-deepcraft-link",
      "use": "markdown links",
      "claude": { "dark": "#a9c2df", "light": "#3d5f86" },
      "deepseek": { "dark": "#8ea2f2", "light": "#3e5bd6" },
      "host": "var(--dsw-alias-link)",
      "note": "Prose links keep an auxiliary hue of their own rather than the accent: the Claude brand's is a warm-compatible slate that sits beside its ember, the DeepSeek brand's the periwinkle of its own blue family (docs/STYLE.md)."
    },
    {
      "token": "--dsh-deepcraft-link-underline",
      "use": "markdown link underline",
      "claude": { "dark": "color-mix(in srgb, var(--dsh-deepcraft-link) 60%, transparent)", "light": "color-mix(in srgb, var(--dsh-deepcraft-link) 60%, transparent)" },
      "host": "color-mix(in srgb, var(--dsw-alias-link) 60%, transparent)",
      "note": "Derived from the link in force, so a brand switch, a custom accent or the host's own link colour never leaves the underline on an earlier hue."
    },
    {
      "token": "--dsw-alias-markdown-code-block",
      "claude": { "dark": "#1c1b1a", "light": "#ffffff" },
      "deepseek": { "dark": "#252a30", "light": "#f7f7f5" },
      "note": "The host pins the code-block surface on `pre.shiki` with !important, so it is only reachable through this token."
    },
    {
      "token": "--dsw-alias-markdown-code-block-banner",
      "claude": { "dark": "#242320", "light": "#ffffff" },
      "deepseek": { "dark": "#2b3038", "light": "#f2f2ef" }
    },
    {
      "token": "--dsw-alias-interactive-bg-hover",
      "claude": { "dark": "var(--dsh-deepcraft-hover-bg)", "light": "var(--dsh-deepcraft-hover-bg)" }
    },
    {
      "token": "--dsw-alias-interactive-bg-hover-solid",
      "use": "the host's solid hover chip",